{
  "schema_version": "2.0",
  "meta": {
    "engine": "fallback", "model": null, "log_file": "fixture.log",
    "generated_at": "2026-01-01T00:00:00Z", "redacted": true, "usage": {},
    "reused": false, "reused_from_key": null,
    "llm": {"status": "not_requested", "fallback_reason": null},
    "trust": {"source_class": "local_artifact", "source_context": true, "enrichment": true, "llm": true, "delivery": true}
  },
  "failure": {
    "stage": "unknown", "kind": "unknown", "summary": "no failure",
    "message": "", "stacktrace": [], "failed_tests": [], "events": []
  },
  "context": {
    "run": {
      "provider": "", "run_id": "", "run_url": "", "job_id": "", "job_name": "",
      "workflow": "", "branch": "", "commit_sha": "", "step_name": "", "attempt": null,
      "conclusion": "", "duration_ms": null, "pr_number": "", "base_sha": "", "head_sha": ""
    },
    "deployment": {
      "platform": "", "environment": "", "cluster": "", "target": "", "namespace": "",
      "release": "", "revision": "", "previous_revision": "", "artifact": "", "strategy": "",
      "started_at": "", "migration_version": "", "outcome": "", "recovery": ""
    },
    "request": {
      "request_id": "", "trace_id": "", "session_id": "", "user_id": "",
      "users": [], "method": "", "path": ""
    },
    "owners": []
  },
  "root_cause": {
    "hypothesis": "No strong automated signal; requires manual investigation.",
    "confidence": "low", "evidence": [], "fix_suggestion": "Inspect the artifact manually."
  },
  "analysis": {
    "observed_facts": [
      {"id": "fact-001", "kind": "failure_classification", "value": {"stage": "unknown", "kind": "unknown"}, "evidence_refs": []}
    ],
    "evidence": [],
    "hypotheses": [
      {
        "id": "hyp-001",
        "statement": "No strong automated signal; requires manual investigation.",
        "source": "deterministic",
        "support_status": "insufficient_evidence",
        "supporting_evidence_refs": [],
        "contradicting_evidence_refs": [],
        "confidence": {"band": "low", "score": 0.1, "reasons": ["no deterministic failure evidence"]},
        "missing_information": ["No collected evidence reference directly supports this hypothesis."],
        "recommended_checks": ["Inspect the artifact manually."]
      }
    ],
    "missing_information": ["No collected evidence reference directly supports this hypothesis."],
    "recommended_checks": ["Inspect the artifact manually."]
  },
  "triage": {
    "severity": "low", "component": "unowned", "priority": 4, "dedup_key": "",
    "is_duplicate_of": null, "flaky_suspect": false, "recurring_incident": false,
    "occurrence_count": 1
  },
  "ticket": {"title": "No failure", "body_md": "Review manually.", "labels": ["severity:low"]}
}
